{
  "$schema": "https://json-schema.org/draft/2020-12/schema",
  "$id": "https://eleveniq.local/contract/v1/player.schema.json",
  "title": "players/<key>.json",
  "description": "One season row. metrics are in registry metric order; their shared facts are in groups/<identity.group>.json.",
  "type": "object", "additionalProperties": false,
  "required": ["stamps", "identity", "stand_out", "defensive_rates", "metrics", "second_group", "signature_traits", "dna", "neighbours", "style_map", "completion_vs_expected", "style_tags"],
  "$defs": {
    "phrasePair": {
      "type": "object", "additionalProperties": false, "required": ["metric", "label", "a_phrase", "b_phrase"],
      "properties": {"metric": {"type": "string"}, "label": {"type": "string"},
                     "a_phrase": {"type": "string"}, "b_phrase": {"type": "string"}}
    }
  },
  "properties": {
    "stamps": {"$ref": "common.schema.json#/$defs/stamps"},
    "identity": {
      "type": "object", "additionalProperties": false,
      "required": ["key", "player_id", "team_id", "competition_id", "season_id", "name", "nickname", "display_name",
                   "team", "league", "group", "group_text", "second_group", "minutes", "minutes_text",
                   "nominal_minutes", "nominal_minutes_text", "meets_gate", "near_gate", "role_text", "dmcm_slot", "summary"],
      "properties": {
        "key": {"$ref": "common.schema.json#/$defs/rowKey"},
        "player_id": {"type": "integer"}, "team_id": {"type": "integer"},
        "competition_id": {"type": "integer"}, "season_id": {"type": "integer"},
        "name": {"type": "string"}, "nickname": {"type": ["string", "null"]},
        "display_name": {"type": "string", "description": "The nickname when present, else the name. Never a key."},
        "team": {"type": "string"}, "league": {"type": "string"},
        "group": {"$ref": "common.schema.json#/$defs/anyGroup"}, "group_text": {"type": "string"},
        "second_group": {"type": ["string", "null"]},
        "minutes": {"type": "number", "minimum": 0}, "minutes_text": {"type": "string"},
        "nominal_minutes": {"type": "number", "minimum": 0},
        "nominal_minutes_text": {"type": "string", "description": "The minutes on the gate's clock (nominal-equivalent, ADR 004 D1): the 900-minute gate counts these, so a row can show 900+ minutes played and still be below the gate."},
        "meets_gate": {"type": "boolean"},
        "near_gate": {"type": "boolean", "description": "\"Fewer minutes: less reliable\": only CB and FB-WB rows with 900 ≤ nominal minutes < 1,350 (ADR 004 §14 sign-off note 3)."},
        "role_text": {"type": ["string", "null"]},
        "summary": {"type": "array", "description": "The season summary line: the pipeline's own counts.", "items": {
          "type": "object", "additionalProperties": false, "required": ["key", "label", "text"],
          "properties": {"key": {"type": "string"}, "label": {"type": "string"}, "text": {"type": "string"}}}},
        "dmcm_slot": {
          "type": ["object", "null"], "additionalProperties": false,
          "required": ["label", "label_text", "share6", "share6_text", "pivot", "pivot_text"],
          "properties": {"label": {"enum": ["6", "8", "mixed"]}, "label_text": {"type": "string"},
                         "share6": {"type": "number", "minimum": 0, "maximum": 1}, "share6_text": {"type": "string"},
                         "pivot": {"enum": ["single", "double", "cm", "mixed"]}, "pivot_text": {"type": "string"}}
        }
      }
    },
    "stand_out": {
      "type": "array", "maxItems": 6,
      "description": "What stands out: the 6 metrics whose shown league percentile is furthest from 50 (style included), ranked by the exporter; ties by registry metric order. order indexes the group metadata.",
      "items": {
        "type": "object", "additionalProperties": false,
        "required": ["metric", "order", "label", "direction", "pct", "pct_text", "phrase", "bin"],
        "properties": {"metric": {"type": "string"}, "order": {"type": "integer"}, "label": {"type": "string"},
                       "direction": {"enum": ["higher_better", "lower_better", "style"]},
                       "pct": {"type": "number"}, "pct_text": {"type": "string"}, "phrase": {"type": "string"},
                       "bin": {"$ref": "common.schema.json#/$defs/bin"}}}
    },
    "defensive_rates": {
      "type": "array",
      "description": "Compare mode's defensive rate (user-approved label): each count per 100 opponent open-play passes made while the player was on the pitch (season counts; the pipeline's exposure column). A plain rate: no percentile, never adjusted. metric is the per-90 metric it accompanies. Empty for goalkeepers; rate null without exposure.",
      "items": {
        "type": "object", "additionalProperties": false,
        "required": ["metric", "count", "exposure", "rate", "rate_text"],
        "properties": {"metric": {"type": "string"}, "count": {"type": "integer", "minimum": 0},
                       "exposure": {"type": "integer", "minimum": 0},
                       "rate": {"type": ["number", "null"], "minimum": 0},
                       "rate_text": {"type": ["string", "null"]}}}
    },
    "metrics": {"type": "array", "items": {"$ref": "common.schema.json#/$defs/metricRow"}},
    "completion_vs_expected": {"oneOf": [{"type": "null"}, {"$ref": "common.schema.json#/$defs/metricRow"}],
      "description": "Completion above expected (plan 006 pre-registration; display only): value in percentage points, league percentile only; metadata in groups/<group>.json completion_vs_expected. Null for goalkeepers."},
    "style_tags": {"type": "array", "maxItems": 3, "items": {
      "type": "object", "additionalProperties": false, "required": ["tag", "metric", "note"],
      "properties": {"tag": {"type": "string"}, "metric": {"type": "string"}, "note": {"type": "string"}}}},
    "second_group": {
      "description": "Display only (ADR 004 D5): scored against a population that does not contain the player.",
      "oneOf": [{"type": "null"}, {
        "type": "object", "additionalProperties": false, "required": ["group", "metrics"],
        "properties": {"group": {"$ref": "common.schema.json#/$defs/group"},
                       "metrics": {"type": "array", "items": {"$ref": "common.schema.json#/$defs/metricRow"}}}}]
    },
    "signature_traits": {
      "type": "array",
      "items": {
        "type": "object", "additionalProperties": false,
        "required": ["metric", "label", "order", "holder", "holder_text", "season_count", "season_count_text", "minimum", "notes"],
        "properties": {
          "metric": {"type": "string"}, "label": {"type": "string"}, "order": {"type": "integer"},
          "holder": {"type": ["boolean", "null"], "description": "null: not assessed (holder_text says why)."},
          "holder_text": {"type": "string"},
          "season_count": {"type": ["number", "null"]}, "season_count_text": {"type": "string"},
          "minimum": {"type": "integer"},
          "notes": {"type": "array", "items": {"$ref": "common.schema.json#/$defs/noteText"}}
        }
      }
    },
    "dna": {
      "oneOf": [{"type": "null"}, {
        "type": "object", "additionalProperties": false, "required": ["status", "vector", "dimensions"],
        "properties": {
          "status": {"enum": ["complete", "partial", "dna_incomplete"]},
          "vector": {"type": "array", "items": {
            "type": "object", "additionalProperties": false,
            "required": ["metric", "label", "family", "direction", "pct", "status", "weight"],
            "properties": {"metric": {"type": "string"}, "label": {"type": "string"}, "family": {"type": "string"},
                           "direction": {"enum": ["higher_better", "lower_better", "style"]},
                           "pct": {"type": ["number", "null"]}, "status": {"type": "string"},
                           "weight": {"type": ["number", "null"]}}}},
          "dimensions": {"type": "array", "items": {
            "type": "object", "additionalProperties": false,
            "required": ["family", "label", "score", "score_text", "members", "status", "withheld_short", "withheld_full", "defending_note", "display_score"],
            "properties": {"family": {"type": "string"}, "label": {"type": "string"},
                           "score": {"type": ["number", "null"]}, "score_text": {"type": ["string", "null"]},
                           "members": {"type": "array", "items": {"type": "string"}},
                           "status": {"type": "string"},
                           "withheld_short": {"type": ["string", "null"]}, "withheld_full": {"type": ["string", "null"]},
                           "defending_note": {"type": ["string", "null"]},
                           "display_score": {"type": "boolean", "description": "true: the display-only Passing score (config.PASSING_SCORE_MEMBERS), not a DNA dimension score; members are the passing metrics used."}}}}
        }}]
    },
    "neighbours": {
      "oneOf": [{"type": "null"}, {
        "type": "object", "additionalProperties": false, "required": ["label", "n_candidates", "items"],
        "properties": {
          "label": {"type": "string"}, "n_candidates": {"type": "integer", "minimum": 0},
          "items": {"type": "array", "maxItems": 10, "items": {
            "type": "object", "additionalProperties": false,
            "required": ["key", "display_name", "team", "league", "distance", "distance_text", "rank", "same_team", "most_different", "most_alike"],
            "properties": {
              "key": {"$ref": "common.schema.json#/$defs/rowKey"},
              "display_name": {"type": "string"}, "team": {"type": "string"}, "league": {"type": "string"},
              "distance": {"type": "number", "minimum": 0, "exclusiveMaximum": 1},
              "distance_text": {"type": "string", "pattern": "^0\\.[0-9]{4}$"},
              "rank": {"type": "integer", "minimum": 1}, "same_team": {"type": "boolean"},
              "most_different": {"type": "array", "items": {"$ref": "#/$defs/phrasePair"}},
              "most_alike": {"type": "array", "items": {"$ref": "#/$defs/phrasePair"}}}}}
        }}]
    },
    "style_map": {"type": ["string", "null"], "description": "The style-map file this row is plotted on, if any."}
  }
}
