{"stamps":{"contract_version":"1.0.0","registry_version":"b9762e99fa2b5f9696b8f21793b9421002a3039de27c28f7373d8857f64f4e26","measurement_source":"statsbomb","source":"statsbomb","season_ids":[27],"season_parquet_sha256":"572ee7948d2fc89a7ff7bea3e6db0abd6308b767f06cf6f9ba58bf79dc82b7f0","percentiles_parquet_sha256":"71dd579ffe7916a7a3ea401a42965d8c2ebb22c0dee12ddd2df27a79deed6003","dna_parquet_sha256":"476bf4fabf14907a2d8fc50f41da63d6371565a072ab2fb2f70c37c9044d5664","positions_parquet_sha256":"a19975bb2bfef9d984eeace3b7c2485690d99c38f1d18a8c3355accd91e1b68e","match_parquet_sha256":"6c97bb09c00046246f956abbe41064655920b0cb272ee7bbc5e2c8ef9b08ac9b","pass_mix_parquet_sha256":"6187aee2b4b59463b96b19b2fc134a142ca9fed98b73fbff103bee9264ad709f"},"identity":{"key":"3057-37-2-27","player_id":3057,"team_id":37,"competition_id":2,"season_id":27,"name":"Jonjo Shelvey","nickname":null,"display_name":"Jonjo Shelvey","team":"Newcastle United","league":"Premier League 2015/16","group":"DM-CM","group_text":"central midfielders","second_group":null,"minutes":1125.0,"minutes_text":"1125","nominal_minutes":1051.495878,"nominal_minutes_text":"1051","meets_gate":true,"near_gate":false,"role_text":"Deep midfielder (DM)","dmcm_slot":{"label":"6","label_text":"6 (holding slot)","share6":0.757188,"share6_text":"76%","pivot":"double","pivot_text":"double pivot (two holding midfielders side by side)"},"summary":[{"key":"appearances","label":"appearances","text":"15"},{"key":"minutes_played","label":"minutes","text":"1125"},{"key":"goals","label":"goals","text":"0"},{"key":"assists","label":"assists","text":"3"},{"key":"xg","label":"xG","text":"0.85"},{"key":"shots","label":"shots","text":"22"}]},"stand_out":[{"metric":"fouls_won_p90","order":17,"label":"Fouls won","direction":"style","pct":0.0,"pct_text":"<1","phrase":"lower than most","bin":"uncoloured"},{"metric":"long_passes_attempted_p90","order":2,"label":"Long passes","direction":"style","pct":98.507463,"pct_text":"99","phrase":"higher than most","bin":"uncoloured"},{"metric":"op_assists_p90","order":25,"label":"Assists (non-restart delivery)","direction":"higher_better","pct":98.507463,"pct_text":"99","phrase":"top 2%","bin":4},{"metric":"assists_p90","order":26,"label":"Assists","direction":"higher_better","pct":98.507463,"pct_text":"99","phrase":"top 2%","bin":4},{"metric":"switches_p90","order":6,"label":"Switches of play","direction":"style","pct":97.014925,"pct_text":"97","phrase":"higher than most","bin":"uncoloured"},{"metric":"restart_assists_p90","order":29,"label":"Restart assists (corners, free kicks, throw-ins and other restarts)","direction":"higher_better","pct":95.522388,"pct_text":"96","phrase":"top 5%","bin":4}],"defensive_rates":[{"metric":"tackles_attempted_p90","count":22,"exposure":5004,"rate":0.439648,"rate_text":"0.44"},{"metric":"interceptions_p90","count":26,"exposure":5004,"rate":0.519584,"rate_text":"0.52"},{"metric":"ball_recoveries_p90","count":64,"exposure":5004,"rate":1.278977,"rate_text":"1.28"},{"metric":"pressures_p90","count":163,"exposure":5004,"rate":3.257394,"rate_text":"3.26"},{"metric":"blocks_p90","count":13,"exposure":5004,"rate":0.259792,"rate_text":"0.26"},{"metric":"clearances_p90","count":16,"exposure":5004,"rate":0.319744,"rate_text":"0.32"}],"metrics":[{"value":0.772727,"value_text":"77.3%","total_text":"527 / 682","local":{"pct":19.402985,"pct_text":"19","phrase":"lower than most","band":"Lower than most","note":"19th percentile among Premier League 2015/16 central midfielders","bin":"uncoloured","n":67,"population_text":"n 67 of 67 DM-CMs with ≥ 68 passes","status":"ok","status_text":null},"global":{"pct":25.938567,"pct_text":"26","phrase":"lower than most","band":"Lower than most","note":"26th percentile among central midfielders in all leagues","bin":"uncoloured","n":293,"population_text":"n 293 of 293 DM-CMs with ≥ 68 passes","status":"ok","status_text":null},"basis":"global","zero_tie":false},{"value":0.616216,"value_text":"61.6%","total_text":"114 / 185","local":{"pct":22.38806,"pct_text":"22","phrase":"lower than most","band":"Lower than most","note":"22nd percentile among Premier League 2015/16 central midfielders","bin":"uncoloured","n":67,"population_text":"n 67 of 67 DM-CMs with ≥ 39 long passes","status":"ok","status_text":null},"global":{"pct":null,"pct_text":null,"phrase":null,"band":null,"note":null,"bin":null,"n":291,"population_text":"n 291 of 293 DM-CMs with ≥ 39 long passes","status":"league_inconsistent","status_text":"not ranked across leagues"},"basis":"local","zero_tie":false},{"value":14.88,"value_text":"14.88","total_text":"186 total","local":{"pct":98.507463,"pct_text":"99","phrase":"higher than most","band":"Higher than most","note":"99th percentile among Premier League 2015/16 central midfielders","bin":"uncoloured","n":67,"population_text":"n 67","status":"ok","status_text":null},"global":{"pct":98.293515,"pct_text":"98","phrase":"higher than most","band":"Higher than most","note":"98th percentile among central midfielders in all leagues","bin":"uncoloured","n":293,"population_text":"n 293","status":"ok","status_text":null},"basis":"global","zero_tie":false},{"value":0.126841,"value_text":"12.7%","total_text":"620 / 4,888","local":{"pct":64.179104,"pct_text":"64","phrase":"higher than most","band":"Higher than most","note":"64th percentile among Premier League 2015/16 central midfielders","bin":"uncoloured","n":67,"population_text":"n 67","status":"ok","status_text":null},"global":{"pct":70.307167,"pct_text":"70","phrase":"higher than most","band":"Higher than most","note":"70th percentile among central midfielders in all leagues","bin":"uncoloured","n":293,"population_text":"n 293","status":"ok","status_text":null},"basis":"global","zero_tie":false},{"value":54.64,"value_text":"54.64","total_text":"683 total","local":{"pct":65.671642,"pct_text":"66","phrase":"higher than most","band":"Higher than most","note":"66th percentile among Premier League 2015/16 central midfielders","bin":"uncoloured","n":67,"population_text":"n 67","status":"ok","status_text":null},"global":{"pct":65.870307,"pct_text":"66","phrase":"higher than most","band":"Higher than most","note":"66th percentile among central midfielders in all leagues","bin":"uncoloured","n":293,"population_text":"n 293","status":"ok","status_text":null},"basis":"global","zero_tie":false},{"value":42.16,"value_text":"42.16","total_text":"527 total","local":{"pct":53.731343,"pct_text":"54","phrase":"around average","band":"Around average","note":"54th percentile among Premier League 2015/16 central midfielders","bin":"uncoloured","n":67,"population_text":"n 67","status":"ok","status_text":null},"global":{"pct":57.679181,"pct_text":"58","phrase":"around average","band":"Around average","note":"58th percentile among central midfielders in all leagues","bin":"uncoloured","n":293,"population_text":"n 293","status":"ok","status_text":null},"basis":"global","zero_tie":false},{"value":3.68,"value_text":"3.68","total_text":"46 total","local":{"pct":97.014925,"pct_text":"97","phrase":"higher than most","band":"Higher than most","note":"97th percentile among Premier League 2015/16 central midfielders","bin":"uncoloured","n":67,"population_text":"n 67","status":"ok","status_text":null},"global":{"pct":94.880546,"pct_text":"95","phrase":"higher than most","band":"Higher than most","note":"95th percentile among central midfielders in all leagues","bin":"uncoloured","n":293,"population_text":"n 293","status":"ok","status_text":null},"basis":"global","zero_tie":false},{"value":6.32,"value_text":"6.32","total_text":"79 total","local":{"pct":76.119403,"pct_text":"76","phrase":"higher than most","band":"Higher than most","note":"76th percentile among Premier League 2015/16 central midfielders","bin":"uncoloured","n":67,"population_text":"n 67","status":"ok","status_text":null},"global":{"pct":72.013652,"pct_text":"72","phrase":"higher than most","band":"Higher than most","note":"72nd percentile among central midfielders in all leagues","bin":"uncoloured","n":293,"population_text":"n 293","status":"ok","status_text":null},"basis":"global","zero_tie":false},{"value":5.92,"value_text":"5.92","total_text":"74 total","local":{"pct":82.089552,"pct_text":"82","phrase":"top 18%","band":"Top 25%","note":"82nd percentile among Premier League 2015/16 central midfielders","bin":3,"n":67,"population_text":"n 67","status":"ok","status_text":null},"global":{"pct":86.348123,"pct_text":"86","phrase":"top 14%","band":"Top 25%","note":"86th percentile among central midfielders in all leagues","bin":3,"n":293,"population_text":"n 293","status":"ok","status_text":null},"basis":"global","zero_tie":false},{"value":0.96,"value_text":"0.96","total_text":"12 total","local":{"pct":85.074627,"pct_text":"85","phrase":"top 15%","band":"Top 25%","note":"85th percentile among Premier League 2015/16 central midfielders","bin":3,"n":67,"population_text":"n 67","status":"ok","status_text":null},"global":{"pct":82.935154,"pct_text":"83","phrase":"top 18%","band":"Top 25%","note":"83rd percentile among central midfielders in all leagues","bin":3,"n":293,"population_text":"n 293","status":"ok","status_text":null},"basis":"global","zero_tie":false},{"value":7.6,"value_text":"7.60","total_text":"95 total","local":{"pct":70.149254,"pct_text":"70","phrase":"higher than most","band":"Higher than most","note":"70th percentile among Premier League 2015/16 central midfielders","bin":"uncoloured","n":67,"population_text":"n 67","status":"ok","status_text":null},"global":{"pct":63.139932,"pct_text":"63","phrase":"higher than most","band":"Higher than most","note":"63rd percentile among central midfielders in all leagues","bin":"uncoloured","n":293,"population_text":"n 293","status":"ok","status_text":null},"basis":"global","zero_tie":false},{"value":1.2,"value_text":"1.20","total_text":"15 total","local":{"pct":44.776119,"pct_text":"45","phrase":"around average","band":"Around average","note":"45th percentile among Prem